{
  "$defs": {
    "ArtifactRef": {
      "additionalProperties": false,
      "description": "Reference to a file or object written under shared storage (/work).",
      "properties": {
        "bytes": {
          "anyOf": [
            {
              "type": "integer"
            },
            {
              "type": "null"
            }
          ],
          "default": null,
          "title": "Bytes"
        },
        "kind": {
          "default": "file",
          "title": "Kind",
          "type": "string"
        },
        "path": {
          "title": "Path",
          "type": "string"
        },
        "sha256": {
          "anyOf": [
            {
              "type": "string"
            },
            {
              "type": "null"
            }
          ],
          "default": null,
          "title": "Sha256"
        }
      },
      "required": [
        "path"
      ],
      "title": "ArtifactRef",
      "type": "object"
    }
  },
  "$schema": "https://json-schema.org/draft/2020-12/schema",
  "additionalProperties": false,
  "properties": {
    "action_name": {
      "anyOf": [
        {
          "type": "string"
        },
        {
          "type": "null"
        }
      ],
      "default": null,
      "title": "Action Name"
    },
    "all_complete": {
      "anyOf": [
        {
          "type": "boolean"
        },
        {
          "type": "null"
        }
      ],
      "default": null,
      "title": "All Complete"
    },
    "artifacts": {
      "items": {
        "$ref": "#/$defs/ArtifactRef"
      },
      "title": "Artifacts",
      "type": "array"
    },
    "capability": {
      "anyOf": [
        {
          "type": "string"
        },
        {
          "type": "null"
        }
      ],
      "default": null,
      "title": "Capability"
    },
    "comparison": {
      "anyOf": [
        {
          "type": "string"
        },
        {
          "type": "null"
        }
      ],
      "default": null,
      "title": "Comparison"
    },
    "completeness_manifest_path": {
      "anyOf": [
        {
          "type": "string"
        },
        {
          "type": "null"
        }
      ],
      "default": null,
      "title": "Completeness Manifest Path"
    },
    "domainSample": {
      "anyOf": [
        {},
        {
          "type": "null"
        }
      ],
      "default": null,
      "title": "Domainsample"
    },
    "duration_ms": {
      "anyOf": [
        {
          "type": "integer"
        },
        {
          "type": "null"
        }
      ],
      "default": null,
      "title": "Duration Ms"
    },
    "exit_code": {
      "default": 0,
      "title": "Exit Code",
      "type": "integer"
    },
    "finished_at_utc": {
      "anyOf": [
        {
          "format": "date-time",
          "type": "string"
        },
        {
          "type": "null"
        }
      ],
      "default": null,
      "title": "Finished At Utc"
    },
    "manifest_path": {
      "anyOf": [
        {
          "type": "string"
        },
        {
          "type": "null"
        }
      ],
      "default": null,
      "title": "Manifest Path"
    },
    "n_comparisons": {
      "anyOf": [
        {
          "type": "integer"
        },
        {
          "type": "null"
        }
      ],
      "default": null,
      "title": "N Comparisons"
    },
    "output_dir": {
      "anyOf": [
        {
          "type": "string"
        },
        {
          "type": "null"
        }
      ],
      "default": null,
      "title": "Output Dir"
    },
    "result_code": {
      "default": 0,
      "title": "Result Code",
      "type": "integer"
    },
    "schema_version": {
      "const": "1.0",
      "default": "1.0",
      "title": "Schema Version",
      "type": "string"
    },
    "started_at_utc": {
      "anyOf": [
        {
          "format": "date-time",
          "type": "string"
        },
        {
          "type": "null"
        }
      ],
      "default": null,
      "title": "Started At Utc"
    },
    "status": {
      "default": "ok",
      "enum": [
        "ok",
        "skipped",
        "failed"
      ],
      "title": "Status",
      "type": "string"
    },
    "stdout_tail": {
      "anyOf": [
        {
          "type": "string"
        },
        {
          "type": "null"
        }
      ],
      "default": null,
      "title": "Stdout Tail"
    },
    "tool": {
      "anyOf": [
        {
          "type": "string"
        },
        {
          "type": "null"
        }
      ],
      "default": null,
      "title": "Tool"
    }
  },
  "title": "EnricherTaskOutput",
  "type": "object"
}
