{
  "action_name": null,
  "all_complete": true,
  "artifacts": [],
  "capability": null,
  "comparison": null,
  "completeness_manifest_path": null,
  "domainSample": null,
  "duration_ms": null,
  "exit_code": 0,
  "finished_at_utc": null,
  "manifest_path": null,
  "n_comparisons": 1,
  "output_dir": null,
  "result_code": 0,
  "schema_version": "1.0",
  "started_at_utc": null,
  "status": "ok",
  "stdout_tail": null,
  "tool": null
}
